"Ukraine, inflation, shortages...: fronts in factories multiply"
"The vast majority of guests at the Matthew 25 Mission are in some way vulnerable, marginalised, disadvantaged and isolated. #ad #Matthew25Mission #homelessness #poverty #hunger #donate"
Why Prices Rise So High
Inflation rose to 7.9% in May
Eurozone: Inflation weakening more than expected
"Wiesn countdown between corona, inflation and energy crisis"
Currency prices today Saturday 4-2-2023
The Fed stuck between inflation and the risk of recession in the US
"We are not in danger of recession, inflation will fall"
"Inflation, debt, taxation: Europe is falling apart again"
Gold and currency prices today...Thursday 31 March 2022
"Amid fears of a recession, Brent oil prices briefly fell below $100, but they didn't last long. The outlook for the market is huge because the prospect of a global recession is still accompanied by a deep shortage of oil on the market."
Currency prices Monday 9-5-2022 in Egypt
Inflation in January at 8.7%
<unk>Inflation: the great blindness<unk> <unk> Julien Aubert's tribune
Black Friday and Cyber Monday: Consumer sentiment against inflation
#Poverty in #Morocco: the Makhzen perpetuate inequality in the service of a small minority <unk>
US inflation: prices rise by 8.5% in March
"There is no sign of recession, but growth is stagnating: the EU Commission's spring forecast is alarming. Looking at the continued high inflation, there is a bit of hope."
"""On Sylt there is homelessness and old age poverty"""
Police deaths: GdP warns against <unk>precondemnation<unk> of police officers
Currency prices on Monday 28-3-2022 in Egypt
Currency prices today Saturday 25-3520
Inflation: the shock will be brutal
Why wasn't Auchan's anti-inflation basket pinned to the UFC-What Choose?
Three years of Brexit: poverty and recession <unk> how the British suffer: a disaster with an announcement
Fuel inflation in road transport
Inflation in Germany: rate decreases markedly
Inflation. Is France better off than its European neighbors?
"First we were engulfed in stagflation, then recession and finally inflation."
Lower unemployment and higher inflation: will wages rise in France? through
"Economist Özgür Demirtaş: Interest is not the cause of inflation, it is the result of inequality"
Inflation: Increase in meat prices confirmed
"We have the lowest unemployment rate in the EU after the Czech Republic, the lack of unemployment makes the inflation rate higher. We have a higher dynamic of energy and food prices."
"Volkswagen, Adler, inflation, the Bundeswehr - that was Tuesday, May 30, 2022"
Inflation and interest rates: Bankruptcy will rise sharply in 2023:
Marco Asensio only plays Estones for not devaluing himself
"Inflation at 9.7%: The sluggish devaluation of money is still at record levels in Austria - the main drivers of prices are airlines, hospitality and gastronomy."
"In times of high inflation, second hand is the first choice"
"Union demands action on austerity-induced shortage of workers and goods.

""The growing labour market crisis is a result of years of cost-cutting and austerity by employers and government, there is no getting away from this"""
"Despite inflation, coffee prices fall in discount stores and supermarkets"
"Zinshammer without a nail: The European Central Bank is overwhelmed by inflation. Their historic rate hike will cost jobs and cause bankruptcy, but not lower inflation. Of (6/x)"
European Commission warns: eurozone is heading for recession and rising inflation
Currency prices today Saturday 4 September 2021
The effect of inequality and poverty on children's health. Don't let the call of Mattarella fall
# Prices # Spent the most # Foreign currencies for their currency
"If the left gets to power, it expects GDP growth of only about one percent."
The region needs security and tackle issues of poverty and unemployment
Inflation particularly affects low-income families
The war in Ukraine has caused oil and gas prices to rise again. This also drives inflation in Germany upwards.
Inflation in Germany in January at 4.9%
Prime inflation. The Grunts of the Small Bosses
High inflation prevents most people from saving
Economic situation: High inflation is a growing concern for the ECB
"Gold and currency prices today...Thursday, February 10, 2022"
"#Inflation in the euro area has reached a new high: consumer prices rose to 8.9% in July, as reported by Eurostat."
Last year's GDP growth was the largest in Hungarian economic history
"# Record prices at #petrol stations and in #supermarkets, drops in the #currency exchanges: Inflation is in our hands, an end is not to be expected. #ZDFinfo #Doku shows causes and possible solutions. 👉"
We have to pay attention to inflation.
Currency prices today
"Dettol and Nurofen owner Reckitt hikes prices by 9.7%, as shop inflation jumps – business live"
GDP reported annual inflation of 64.27 percent
Heidelberg's student work: Inflation was already increasing in 1922
Consumers must expect higher prices
"Profit-driven inflation: High inflation due to higher energy prices is only half the story. Guest commentary by Joel Tölgyes, economist at the Momentum Institute."
Iceland boss gives stark warning over food prices as inflation bites shoppers
GdP moniert: Federal police to step in on control
"Producer prices are seen as an early indication of the impending trend in inflation. In the meantime, higher producer prices are coming to consumers. In May they increased by 36.3 percent."
Dax continues to expand despite rising inflation
Poverty and unemployment: children work alongside their families.
"According to GDP, annual inflation is 85.5 percent."
"⛽ But prices at the pump are also being driven by a shortage of petrol and diesel, types of refined crude oil.

And experts are warning that prices are likely to continue increasing.

Read more here:"
Currency prices start trading on Thursday 30 September
Currency and gold prices today Wednesday 23-2-2022
"In Poland, inflation continued to accelerate in August. Consumer prices increased by 16.1% compared to the previous month,"
Arab currency prices in banks today
Inflation in Turkey rises to more than 80 percent
Unemployment registrations in the United States are losing their predictive power. The sharp rise in weekly unemployment insurance applications does not necessarily mean a recession. By
Electricity prices could plunge millions of Britons into energy poverty
Inflation and rising energy prices: One third of Bavaria fears a monetary crisis
Turkish inflation continues to rise to almost 85 percent
Record high: April inflation rises to 7.4%
These prices hurt consumers
7%: Inflation rising slightly in the euro area
"Inflation: the rise in food prices has accelerated, while energy prices are slowing down."
China's GDP outstripped the European Union
The reluctance is hampering efforts to reduce poverty and deprivation.
"#Inflation, #recession, #depression? #DeutscheBank, #Mercedes and #Unicredit are making record profits. Most social institutions are in danger of going out of business soon."
Hohenheim University is suffering from restructuring congestion and inflation
Minister of Planning: A decent life aims to reduce poverty and unemployment and improve quality of life
Currency prices today Sunday 26-2-2023 in Egypt
Britain shows where inflation is heading
"🔴We are entering an increasingly dystopian world of soaring gas prices, energy shortages, fuel poverty, warnings of blackouts and school closures"
Public debt is reduced to 116.1% of GDP due to inflation
<unk> Currency prices started rising this week; $17.25
Recession pressure on oil prices
IMF tells central banks to focus on inflation as recession looms
High inflation is a growing concern for the ECB
"#phoenixUnderDenLinden today discusses the topic ""In the wake of #inflation - Fear of #poverty"" with: - Franziska Parl. Secretary of State - Amira Mohamed Ali MdB, Head of State"
The #GdP in #MV fears security breaches due to the overload of officials. The Ministry of the Interior disagrees.
Inflation is reducing demand for strawberries from the region
Ukraine-Ticker war: report on the current situation in Mariupol; FDP for heavy weapons supplies; inflation as high as in the 1980s due to rising energy prices:
"# Currency prices today Sunday, June 12, 2022 for details"
Food poverty campaigner Jack Monroe welcomes inflation data shake-up
Index rental contracts: how landlords use inflation
"# Currency prices today Tuesday, October 5, 2021 for details"
Well 9.2% in January: Economists expect higher inflation again
"Currency prices today Wednesday, September 21, 2022"
"Inflation and poverty. In Brazil, the pandemic has exacerbated food insecurity"
"Prices in Austria are rising even faster than the Austrian statistics initially expected. In January, inflation was 11.2 percent."
Winners of the crisis: Farmers benefiting from inflation
"In a study, the ZEW Mannheim examined how high energy prices and inflation affect start-ups in Germany. In which age group is more founded. [€]"
Inflation in Europe: Germany suddenly worse than Italy
Energy drives inflation in Germany to almost 8 percent
Australia politics live: poverty rises in NSW; inflation pointer to RBA rates decision
"Immediately, foreign currency prices fall against the Egyptian pound."
It is estimated that a one-year break could mean a saving of 70 to 100 thousand forints per year. The impact of the measure on GDP is negligible.
"Everything is getting more expensive, except the TV? This calls for #MarkusSöder as a measure against #inflation. There is no shortage of opinions."
Inflation: The wild history of stable money
Olive oil shortage could hit UK supermarkets as Spanish drought pushes up prices
<unk>Ukrainian war drives German inflation to 7.3%<unk> (
Book tip: The great inflation from 1914 to 1924
High inflation in Europe: only painful ways:
"Low wages, material shortages and unemployment at home: poverty is registered for 2.5 million workers"
Austerity and fewer visitors in the region to cope with inflation
The bathroom design mistake that could be devaluing your home
Currency prices today Saturday 8-10-2022
Poverty and unemployment are reflected in the GRACE! 53 thousand applications to 60 cleaners
+++ EIL +++ Inflation will increase to 7.9% in 2022.
Istanbul Statistics Office published data for the second half of the year: rising inflation increases income inequality
Fossil vs. green inflation: the environment hardly drives prices
What would a recession mean for house prices? Experts predict two-fold housing market jolt
Currency prices on Friday 10 February 2023
Inflation burdens industry: trade union president fears insolvency wave
"According to GDP, annual inflation is 21.31 percent. But the Inflation Research Group says it's 58.65 percent."
The European Central Bank has also increased its projection for eurozone GDP growth this year due to falling energy prices.
Inflation tops the 4% mark
Royal Mail warned prices could be further impacted by inflation.
Inflation: millions of Britons forced to skip meals
Currency prices today.
Development over 20 years: pensions are rising more than inflation
+++ Emergency message +++: Ampel government expects recession and high inflation of seven percent in 2023
Black &amp; Asian unemployment rate over double that of white people as recession looms
"It comes from special surveillance, not austerity. GDP has fallen by 35% since 2008, public debt has risen from 109 to 190%, poverty has exploded and the Troika knew for 10 years that this would happen."
High inflation is a growing concern for the ECB
US reeling from tampon shortage as prices of menstrual products go up
David Smith recounts the warning of an economist friend that Argentina’s attempt to avoid devaluing its currency will only deepen the crisis
Inflation rate rises to 4.5% in October
Currency prices on Tuesday 5-7-2022 in Egypt
"Average UK household faces a £100 monthly shortage due to soaring bills, new report warns

🔴 It's predicted the ongoing crisis will push 1.3 million people into poverty"
"The longer the inflation lasts, the more people lose."
Index rents: Fear of rents rising with inflation
#IPC: food products stimulate inflation
Inflation and economy: US Federal Reserve Chairman Powell worried about Omikron
Unemployment and homelessness are taking to the streets of Damascus.
Inflation has come into everyday life. Here you can find out which consumer goods have increased their prices. (About)
UK inflation hits 41-year high as WTO warns of recession in major economies
Putin ordered to reduce poverty and income inequality in 2022
'People will die!' Martin Lewis warns energy prices to plunge Britons into poverty
Currency prices today Saturday 13-5-2023
Inflation: 9 euro ticket and other relief: Who helps what?
"Today's comments: Austerity, we can no longer be ""without"""
Inflation: Clinics in Lower Saxony are saving resources
Inflation: banks commit to limiting rate increases
Asklepios clinic group is asking for help because of inflation
Wage increases again well below inflation
"War, inflation: <unk>Middle generation<unk> highly uncertain"
"Although inflation is declining, food prices were significantly higher in May than a year earlier."
Inequality and austerity undermine UK life expectancy targets
Inflation: Who suffers from rising prices <unk> the most important questions and answers
The global recession of inflation. Is Syria drowning in the swamp?
"With a shortage of cheese in the aftermath of coronavirus, Simon warns that prices rises will affect consumers ⬇️"
Inflation is also evident in Switzerland: the inflation rate rises to 3.4 percent in June.
Currency prices on Friday 14-4-2023
"As the GDP continues to rise, here's a look at what a recession is and how likely it is to happen in the UK."
"BoE: UK faces longest recession in a century, inflation to peak"
"#Inflation: food prices fell in July, according to FAO"
"Analysts warn the more stubborn inflation proves, the greater the risk of recession in the US."
Inflation is stable in Russia and unemployment is at its lowest levels
Inflation back above 5 percent - A further rise threatens
A series of interest rate hikes is set to curb galloping US inflation:
The Land Poverty Conference in Lower Saxony warned of increasing poverty in the face of rising energy costs and high inflation.
Inflation or Poverty? The challenges of Italian savings in 2022
Inflation: How big is the risk to the economy?
"Inflation, recession, war in Europe: Memories of #Lehman are back <unk> whether we are facing a new #financial crisis, analyze and"
Food inflation: prices rise in the Alpes-Maritimes and the Var
"Inflation, energy, Corona: Who will pay the billions?The following:"
